{
  "schema_version": 1,
  "schema_ref": "../schemas/learning-diagnostics-day.schema.json",
  "date": "2026-09-01",
  "source": "conversation",
  "source_event_seq": [13, 14, 15],
  "session_evidence": [
    "Cold-reconstructed Application.serve from the MP7 spec without consulting the old serve implementation.",
    "WSL2: pytest -q test_webserver.py -> 28 passed in 21.14s.",
    "Reviewed test_no_routes, test_chopped_message, test_several_message, and the apprunner generator harness as executable specifications."
  ],
  "collisions": [
    {
      "collision_id": "C-20260901-001",
      "date": "2026-09-01",
      "context": "Application.serve: beginning HTTP framing from asyncio.StreamReader",
      "task": "Cold-reconstruct the request read/framing loop",
      "stage": "representation-boundary",
      "intent_already_known": "The server needed to receive HTTP data and find the header boundary.",
      "observed_attempt": "Tried to apply byte-oriented operations such as find() directly to the StreamReader before reinstating the read -> chunk -> buffer boundary.",
      "observed_failure": "StreamReader is the stream source object, not the bytes value being parsed.",
      "missing_dimension": "Acquisition object versus data representation: await reader.read(n) produces bytes; parsing belongs on bytes held in a buffer.",
      "repair": "Read a chunk with await reader.read(4096), append it to a bytes buffer, and parse the buffer.",
      "working_hypothesis": "The architectural goal was retained, but the concrete API/data boundary was not yet automatic during cold generation.",
      "recovery": {
        "cue_level": "A2",
        "cue": "StreamReader is the faucet; chunk/buffer are the water/bytes.",
        "outcome": "immediate-after-cue",
        "user_reconstructed": true
      },
      "classification": ["python-api-automaticity", "representation-boundary", "asyncio-io"],
      "recurrence_key": "io-object-vs-data",
      "evidence": ["Initial serve draft operated on reader where bytes operations were required."],
      "review_status": "watch"
    },
    {
      "collision_id": "C-20260901-002",
      "date": "2026-09-01",
      "context": "Application.serve: preserving partial HTTP requests across read() calls",
      "task": "Cold-reconstruct the persistent request buffer",
      "stage": "state-lifetime",
      "intent_already_known": "A request can arrive incompletely and needs a buffer.",
      "observed_attempt": "Initialized buffer = b'' inside the outer read loop.",
      "observed_failure": "Each new read iteration would discard bytes from prior chunks, so a delimiter split across reads could never be reconstructed.",
      "missing_dimension": "The lifetime of the state: buffer must live for the connection, not for one read iteration.",
      "repair": "Initialize buffer before the outer read loop and only remove bytes after a complete request is consumed.",
      "working_hypothesis": "The need for state was known before the required scope/lifetime of that state was checked.",
      "recovery": {
        "cue_level": "A2",
        "cue": "What happens if one request is split across multiple reads?",
        "outcome": "immediate-after-cue",
        "user_reconstructed": true
      },
      "classification": ["state-lifetime", "control-flow", "protocol-framing"],
      "recurrence_key": "state-lifetime-scope",
      "evidence": ["test_chopped_message later made this failure mode explicit by splitting CRLFCRLF across sends."],
      "review_status": "candidate-for-drill"
    },
    {
      "collision_id": "C-20260901-003",
      "date": "2026-09-01",
      "context": "Application.serve: consuming more than one request already present in buffer",
      "task": "Cold-reconstruct outer read loop plus inner framing loop",
      "stage": "control-flow",
      "intent_already_known": "The MP7 spec said one reader chunk may contain many HTTP messages.",
      "observed_attempt": "Knew an inner loop was needed but was unsure where it begins, how it runs again, and where a completed request should be popped.",
      "observed_failure": "The control-flow model was incomplete even though the multi-message requirement was already known.",
      "missing_dimension": "After consuming request_bytes, buffer = buffer[request_end:] leaves the remainder and normal while True iteration automatically attempts the next message.",
      "repair": "Place while True after buffer += chunk; consume one complete request; retain remainder; process it; allow the loop to naturally iterate again.",
      "working_hypothesis": "The semantic requirement was available before the nested-loop execution trace was automatic enough to generate code directly.",
      "recovery": {
        "cue_level": "A3",
        "cue": "After cutting request A, what exact bytes should remain in buffer, and where should while True be relative to buffer += chunk?",
        "outcome": "immediate-after-cue",
        "user_reconstructed": true
      },
      "classification": ["control-flow", "nested-loops", "protocol-framing"],
      "recurrence_key": "nested-loop-state-machine",
      "evidence": ["test_several_message later confirmed the inner loop must consume GET, POST+body, and DELETE from one send."],
      "review_status": "candidate-for-drill"
    },
    {
      "collision_id": "C-20260901-004",
      "date": "2026-09-01",
      "context": "Application.serve: parsing raw HTTP bytes into Request fields",
      "task": "Keep bytes/str representation boundaries consistent",
      "stage": "representation-boundary",
      "intent_already_known": "Request should expose method/path/headers as strings while preserving body as bytes.",
      "observed_attempt": "Mixed string delimiters with bytes buffers and temporarily decoded values again after they were already strings.",
      "observed_failure": "The desired final types were known, but conversion points were inconsistent during implementation.",
      "missing_dimension": "Raw network parsing should remain bytes until a deliberate decode boundary; decoded header values should not be decoded again.",
      "repair": "Use bytes delimiters while framing, decode request-line/header text once, and keep body_bytes unchanged.",
      "working_hypothesis": "bytes/str direction is conceptually understood but remains a recurring local automaticity gap during code generation.",
      "recovery": {
        "cue_level": "A2",
        "cue": "What are the exact expected types of method, path, headers, and body_bytes at Request construction?",
        "outcome": "immediate-after-cue",
        "user_reconstructed": true
      },
      "classification": ["python-automaticity", "bytes-str-boundary", "representation-boundary"],
      "recurrence_key": "bytes-str-boundary",
      "evidence": ["The final Request invariant was reconstructed as method:str, path:str, headers:dict[str,str], body_bytes:bytes."],
      "review_status": "candidate-for-drill"
    },
    {
      "collision_id": "C-20260901-005",
      "date": "2026-09-01",
      "context": "Application.serve: parsing each HTTP header line",
      "task": "Translate known 'name: value' grammar into Python string operations",
      "stage": "api-syntax",
      "intent_already_known": "Each header line contains a header name and header value separated by ': '.",
      "observed_attempt": "Wrote header_name, header_value = info_header after decoding the header block.",
      "observed_failure": "Python would iterate/unpack characters from the string rather than parse the two semantic fields.",
      "missing_dimension": "The concrete Python operation expressing the known grammar: split(': ', 1).",
      "repair": "header_name, header_value = info_header.decode('utf-8').split(': ', 1)",
      "working_hypothesis": "This is a direct example of semantic intent being ahead of Python expression automaticity.",
      "recovery": {
        "cue_level": "A2",
        "cue": "info_header is one string such as 'Host: localhost'; how do you split it into exactly two fields?",
        "outcome": "immediate-after-cue",
        "user_reconstructed": true
      },
      "classification": ["python-api-automaticity", "string-parsing"],
      "recurrence_key": "semantic-intent-to-python-idiom",
      "evidence": ["The protocol grammar was already understood before the correct split expression was generated."],
      "review_status": "watch"
    },
    {
      "collision_id": "C-20260901-006",
      "date": "2026-09-01",
      "context": "Application.serve: optional Content-Length lookup",
      "task": "Represent an optional mapping key without raising KeyError",
      "stage": "api-syntax",
      "intent_already_known": "Content-Length may be absent and should default to zero in the MP7 subset.",
      "observed_attempt": "Used headers['Content-Length'] and then checked whether the value was None.",
      "observed_failure": "Missing keys raise KeyError before a None check can happen.",
      "missing_dimension": "Python's optional mapping-access idiom: dict.get(key[, default]).",
      "repair": "content_length = int(headers.get('Content-Length', '0'))",
      "working_hypothesis": "The optional-state semantics were already available; the Python dict idiom was not retrieved automatically.",
      "recovery": {
        "cue_level": "A2",
        "cue": "This key may not exist; avoid direct indexing.",
        "outcome": "immediate-after-cue",
        "user_reconstructed": true
      },
      "classification": ["python-api-automaticity", "dict-access", "optional-state-expression"],
      "recurrence_key": "optional-map-access",
      "evidence": ["User explicitly asked how to avoid KeyError and immediately incorporated .get()."],
      "review_status": "watch"
    },
    {
      "collision_id": "C-20260901-007",
      "date": "2026-09-01",
      "context": "Application.serve: route lookup",
      "task": "Map a known (method, path) tuple directly to its handler",